{
  "$schema": "./config.schema.json",
  "site": {
    "title": "Neuro-Oracle: A Trajectory-Aware Agentic RAG Framework for Interpretable Epilepsy Surgical Prognosis",
    "titleLines": [
      "Neuro-Oracle: A Trajectory-Aware Agentic RAG Framework",
      "for Interpretable Epilepsy Surgical Prognosis"
    ],
    "venue": "AAAI 2026 Fall Symposium Series",
    "description": "Neuro-Oracle encodes pre-to-post-operative MRI change as a 512-dimensional trajectory vector, retrieves similar historical cases, and grounds an interpretable epilepsy surgical prognosis in them with a quantized Llama-3-8B agent.",
    "keywords": "Epilepsy Surgery, Surgical Prognosis, Longitudinal MRI, Siamese Network, Supervised Contrastive Learning, Retrieval-Augmented Generation, Agentic RAG, Large Language Models, Llama-3, FAISS, EPISURG, Interpretability, AAAI 2026 Fall Symposium Series",
    "favicon": "favicon.ico",
    "lang": "en",
    "url": "",
    "publicationDate": "2026"
  },
  "authors": [
    { "name": "Aizierjiang Aiersilan", "url": "https://ezharjan.github.io/", "affiliations": [1] },
    { "name": "Mohamad Koubeissi", "url": "https://capitalmedicalgroup.com/profile/mohamad-koubeissi", "affiliations": [1] }
  ],
  "affiliations": [
    { "id": 1, "name": "The George Washington University" }
  ],
  "links": [
    { "type": "arxiv", "label": "arXiv", "icon": "ai ai-arxiv", "url": "https://arxiv.org/abs/2604.14216", "enabled": true },
    { "type": "code", "label": "Code", "icon": "fab fa-github", "url": "REPLACE_ME", "enabled": false },
    { "type": "confab", "label": "Confab", "icon": "fas fa-calendar-check", "url": "https://cal.com/ezhar/30min", "enabled": true },
    { "type": "slides", "label": "Slides", "icon": "fas fa-chalkboard-teacher", "url": "NeuroOracle_AizierjiangAiersilan_silides4AAAI2026FSS.pdf", "enabled": true },
    { "type": "paper", "label": "Paper", "icon": "fas fa-file-pdf", "url": "https://aaai.org/conference/fall-symposia/2026-fall-symposium-series-2/", "enabled": true }
  ],
  "abstract": {
    "title": "Abstract",
    "body": "Predicting post-surgical seizure outcomes in pharmacoresistant epilepsy is a clinical challenge. Conventional deep-learning approaches operate on static, single-timepoint pre-operative scans, omitting longitudinal morphological changes. We propose <i>Neuro-Oracle</i>, a three-stage framework that: (i) distils pre-to-post-operative MRI changes into a compact 512-dimensional trajectory vector using a 3D Siamese contrastive encoder; (ii) retrieves historically similar surgical trajectories from a population archive via nearest-neighbour search; and (iii) synthesises a natural-language prognosis grounded in the retrieved evidence using a quantized Llama-3-8B reasoning agent. Evaluations are conducted on the public EPISURG dataset (<i>N</i>=268 longitudinally paired cases) using five-fold stratified cross-validation. Since ground-truth seizure-freedom scores are unavailable, we utilize a clinical proxy label based on the resection type. We acknowledge that the network representations may potentially learn the anatomical features of the resection cavities (i.e., temporal versus non-temporal locations) rather than true prognostic morphometry. Our current evaluation thus serves mainly as a proof-of-concept for the trajectory-aware retrieval architecture. Trajectory-based classifiers achieve AUC values between 0.834 and 0.905, compared with 0.793 for a single-timepoint ResNet-50 baseline. The Neuro-Oracle agent (M5) matches the AUC of purely discriminative trajectory classifiers (0.867) while producing structured justifications with zero observed hallucinations under our audit protocol. A Siamese Diversity Ensemble (M6) of trajectory-space classifiers attains an AUC of 0.905 without language-model overhead."
  },
  "sections": [
    {
      "type": "group",
      "title": "Dataset and Preprocessing",
      "blocks": [
        {
          "type": "text",
          "align": "justify",
          "body": "All experiments use EPISURG, a public collection of 430 T1-weighted MRI scans from epilepsy surgery patients; 268 subjects have both a pre-operative and a post-operative scan. Because the public release contains no per-patient Engel seizure-freedom scores, each subject receives a binary proxy label derived from surgery type. Temporal procedures, including lobectomy, lesionectomy, and multilobar temporal resections, are labelled <i>y</i>&nbsp;=&nbsp;0 (favourable outcome proxy, cited seizure-freedom rate 65–70% at two years), while purely extra-temporal (frontal, parietal, occipital) resections and hemispherectomy are labelled <i>y</i>&nbsp;=&nbsp;1 (less-favourable outcome proxy, cited rate 40–55%). The cohort comprises 215 subjects with <i>y</i>&nbsp;=&nbsp;0 and 53 with <i>y</i>&nbsp;=&nbsp;1, a ratio of roughly 4:1. Each post-operative scan is rigidly registered (6 DOF) to its pre-operative scan with ANTsPy; both volumes are then z-score normalised and centre-cropped or zero-padded to a 128&nbsp;×&nbsp;128&nbsp;×&nbsp;128 grid at 1&nbsp;mm isotropic resolution. Deformable registration is deliberately avoided, since non-linear warping would smooth the localised volume changes the model aims to capture."
        },
        {
          "type": "callout",
          "variant": "danger",
          "body": "<b>Proxy-label caveat.</b> Because the label follows resection type and every model sees the post-operative scan, the networks may learn the anatomy of temporal versus non-temporal resection cavities rather than subtle epileptogenic pathology, in effect predicting surgery type instead of seizure outcome. All reported metrics therefore measure proxy-label recovery, not clinical seizure-freedom prognosis. Neuro-Oracle should be read as an architectural proof-of-concept, designed to be readily applicable once per-patient outcome registries become available."
        }
      ]
    },
    {
      "type": "group",
      "title": "Method",
      "blocks": [
        {
          "type": "figure",
          "image": "static/images/framework.png",
          "alt": "Neuro-Oracle in three phases: trajectory encoding with a shared 3D ResNet-50, trajectory retrieval from a FAISS population archive, and agentic RAG prognosis with Llama-3-8B-Instruct",
          "width": "100%",
          "caption": "<b>Figure 1.</b> Overview of the proposed Neuro-Oracle framework. (i) Pre- and post-operative MRI pairs are registered and encoded through a shared 3D Siamese ResNet-50 backbone. (ii) The morphological difference is projected into a compact trajectory vector, which is used to retrieve historically similar cases from a population archive. (iii) A quantized LLM reasoning agent evaluates the retrieved evidence to synthesize a transparent, natural-language surgical prognosis."
        },
        {
          "type": "list",
          "ordered": true,
          "align": "left",
          "items": [
            "<b>Contrastive trajectory encoding.</b> A weight-shared 3D Siamese ResNet-50 encodes the pre-operative scan and the rigidly co-registered post-operative scan. An MLP head projects their feature difference to a 512-dimensional, <span class=\"nowrap\">ℓ<sub>2</sub>-normalised</span> trajectory vector Δ<i>v</i>. The encoder is trained with an equal-weight sum of Supervised Contrastive loss (temperature τ&nbsp;=&nbsp;0.07) and Focal Loss, the latter countering the 4:1 class imbalance.",
            "<b>Population archive and retrieval.</b> The frozen encoder embeds every training subject, and the resulting unit-norm vectors are stored in a FAISS exact inner-product index (<span class=\"is-family-monospace\">IndexFlatIP</span>), so the inner product equals cosine similarity. For each query, the <i>k</i>&nbsp;=&nbsp;5 most similar historical trajectories are retrieved.",
            "<b>Calibrated LLM reasoning agent.</b> The query profile and the retrieved neighbours (age, sex, outcome) form a structured prompt for a 4-bit NF4 quantized Llama-3-8B-Instruct, which is instructed to set aside matches with an age gap above 15 years and to answer SUCCESS or FAILURE with a one-sentence justification. The final probability blends the neighbour vote with the LLM verdict as <i>p</i><sub>Oracle</sub> = 0.60&nbsp;×&nbsp;<i>p</i><sub>neighbor</sub> + 0.40&nbsp;×&nbsp;<i>p</i><sub>LLM</sub>, where <i>p</i><sub>neighbor</sub> is the fraction of retrieved neighbours with <i>y</i>&nbsp;=&nbsp;1 and <i>p</i><sub>LLM</sub> is 0.20 for a SUCCESS verdict and 0.80 otherwise. A case is assigned <i>y</i>&nbsp;=&nbsp;1 when <i>p</i><sub>Oracle</sub> exceeds the default threshold of 0.50."
          ]
        }
      ]
    },
    {
      "type": "text",
      "title": "Experimental Setup",
      "align": "justify",
      "body": "All methods are evaluated with five-fold stratified cross-validation (seed 42), which preserves the 4:1 class ratio in every fold. For each test fold, an independent encoder is trained on the other four folds, and the FAISS index is rebuilt from that split's non-augmented training subjects only, so no test subject or augmented sample ever enters the retrieval pool. Seven methods are compared on the same 268 subjects: two static single-timepoint baselines trained on the post-operative scan, ResNet-50 (M1) and 3D-ViT (M2); four classifiers on frozen trajectory vectors, namely logistic regression (M3), a 2-layer MLP (M3b), cosine <span class=\"nowrap\"><i>k</i>-NN</span> (M4), and the Siamese Diversity Ensemble (M6), an equal-weight soft vote over ExtraTrees, two MLPs, and a calibrated RBF-SVC; and Neuro-Oracle (M5). AUC-ROC is the primary metric, and F1, sensitivity, specificity, and balanced accuracy are secondary. All metrics are computed on the union of the five held-out folds, which covers each subject exactly once."
    },
    {
      "type": "group",
      "title": "Results",
      "blocks": [
        { "type": "subtitle", "text": "Primary Performance Comparison" },
        {
          "type": "text",